similitud,codigo_1,codigo_2,establecimiento_1,establecimiento_2,jornada_1,jornada_2,modalidad_1,modalidad_2,plan_1,plan_2,director_1,director_2,status_1,status_2
100.0,10-01-0353-46,10-01-0354-46,"COLEGIO ""INNOVACION TECNOLOGICA""","COLEGIO ""INNOVACION TECNOLOGICA""",DOBLE,DOBLE,MONOLINGUE,MONOLINGUE,FIN DE SEMANA,FIN DE SEMANA,NANCY ELIZABETH BARRERA CASTAÑEDA,NANCY ELIZABETH BARRERA CASTAÑEDA,ABIERTA,ABIERTA
100.0,10-01-0275-46,10-01-0278-46,"INSTITUTO TECNICO PRIVADO ""JOSE ORTEGA Y GASSET""","INSTITUTO TECNICO PRIVADO ""JOSE ORTEGA Y GASSET""",DOBLE,DOBLE,MONOLINGUE,MONOLINGUE,FIN DE SEMANA,FIN DE SEMANA,CLAUDIA NOHEMI GUZMÁN MARTÍNEZ,CLAUDIA NOHEMI GUZMÁN MARTÍNEZ,ABIERTA,ABIERTA
100.0,10-01-0235-46,10-01-0237-46,COLEGIO PRIVADO MIXTO JUAN DIEGUEZ OLAVERRI,COLEGIO PRIVADO MIXTO JUAN DIEGUEZ OLAVERRI,DOBLE,DOBLE,MONOLINGUE,MONOLINGUE,FIN DE SEMANA,FIN DE SEMANA,LETTY ALEXANDRA OSORIO FIGUEROA,LETTY ALEXANDRA OSORIO FIGUEROA,CERRADA DEFINITIVAMENTE,CERRADA DEFINITIVAMENTE
100.0,10-01-0230-46,10-01-0231-46,COLEGIO PANAMERICANO NO. 8,COLEGIO PANAMERICANO NO. 8,DOBLE,DOBLE,MONOLINGUE,MONOLINGUE,FIN DE SEMANA,FIN DE SEMANA,EVELYN MAGALI CRUZ ALVARADO,EVELYN MAGALI CRUZ ALVARADO,CERRADA DEFINITIVAMENTE,CERRADA DEFINITIVAMENTE
100.0,10-01-0209-46,10-01-0210-46,"COLEGIO PRIVADO MIXTO ""CENTRO EDUCATIVO MAZATECO""","COLEGIO PRIVADO MIXTO ""CENTRO EDUCATIVO MAZATECO""",DOBLE,DOBLE,MONOLINGUE,MONOLINGUE,FIN DE SEMANA,FIN DE SEMANA,OTTO ERIC NEFTALÍ MARTINEZ OBREGON,OTTO ERIC NEFTALÍ MARTINEZ OBREGON,ABIERTA,ABIERTA
100.0,10-01-0174-46,10-01-0175-46,"COLEGIO PRIVADO MIXTO ""PESTALOZZI""","COLEGIO PRIVADO MIXTO ""PESTALOZZI""",DOBLE,DOBLE,MONOLINGUE,MONOLINGUE,FIN DE SEMANA,FIN DE SEMANA,SILVIA VANESSA OCAL PACAY,SILVIA VANESSA OCAL PACAY,ABIERTA,ABIERTA
100.0,10-01-0104-46,10-01-2481-46,INSTITUTO PRIVADO MIXTO PROFESIONAL VISION EDUCATIVA 2000,INSTITUTO PRIVADO MIXTO PROFESIONAL VISION EDUCATIVA 2000,DOBLE,DOBLE,MONOLINGUE,MONOLINGUE,FIN DE SEMANA,FIN DE SEMANA,SANDRA TRINIDAD PEREZ DOMINGUEZ,SANDRA TRINIDAD PEREZ DOMINGUEZ,CERRADA TEMPORALMENTE,CERRADA TEMPORALMENTE
100.0,10-01-0100-46,10-01-2605-46,COLEGIO TECNICO SUCHITEPEQUEZ,COLEGIO TECNICO SUCHITEPEQUEZ,DOBLE,DOBLE,MONOLINGUE,MONOLINGUE,FIN DE SEMANA,FIN DE SEMANA,BRENDA LORENY PEREZ MAYORGA,BRENDA LORENY PEREZ MAYORGA,CERRADA TEMPORALMENTE,CERRADA TEMPORALMENTE
100.0,10-01-0100-46,10-01-2604-46,COLEGIO TECNICO SUCHITEPEQUEZ,COLEGIO TECNICO SUCHITEPEQUEZ,DOBLE,DOBLE,MONOLINGUE,MONOLINGUE,FIN DE SEMANA,FIN DE SEMANA,BRENDA LORENY PEREZ MAYORGA,BRENDA LORENY PEREZ MAYORGA,CERRADA TEMPORALMENTE,CERRADA TEMPORALMENTE
100.0,10-01-0078-46,10-01-0302-46,COLEGIO PRIVADO MIXTO LICEO MAZATECO,COLEGIO PRIVADO MIXTO LICEO MAZATECO,VESPERTINA,VESPERTINA,MONOLINGUE,MONOLINGUE,DIARIO(REGULAR),DIARIO(REGULAR),ALBA PATRICIA CIFUENTES DIAZ,ALBA PATRICIA CIFUENTES DIAZ,ABIERTA,ABIERTA
100.0,18-04-0429-46,18-04-0431-46,"INSTITUTO PARTICULAR MIXTO ""GÉNESIS""","INSTITUTO PARTICULAR MIXTO ""GÉNESIS""",DOBLE,DOBLE,MONOLINGUE,MONOLINGUE,FIN DE SEMANA,FIN DE SEMANA,NUBAR ENID MOLINEROS ORTEGA,NUBAR ENID MOLINEROS ORTEGA,ABIERTA,ABIERTA
100.0,12-12-0103-46,12-12-0104-46,INED INSTITUTO NACIONAL DE EDUCACIÓN DIVERSIFICADA,INED INSTITUTO NACIONAL DE EDUCACIÓN DIVERSIFICADA,VESPERTINA,VESPERTINA,MONOLINGUE,MONOLINGUE,DIARIO(REGULAR),DIARIO(REGULAR),DESCONOCIDO,DESCONOCIDO,TEMPORAL NOMBRAMIENTO,TEMPORAL NOMBRAMIENTO
100.0,10-08-1959-46,10-08-2508-46,INSTITUTO DE EDUCACION AVANZADA,INSTITUTO DE EDUCACION AVANZADA,DOBLE,DOBLE,MONOLINGUE,MONOLINGUE,FIN DE SEMANA,FIN DE SEMANA,SINDY CARLOTA MANCIO MÉNDEZ,SINDY CARLOTA MANCIO MÉNDEZ,ABIERTA,ABIERTA
100.0,03-02-0269-46,03-02-1399-46,COLEGIO MIXTO LICEO LATINO,COLEGIO MIXTO LICEO LATINO,VESPERTINA,VESPERTINA,MONOLINGUE,MONOLINGUE,DIARIO(REGULAR),DIARIO(REGULAR),GENARO RODRÍGUEZ PEREIRA,GENARO RODRÍGUEZ PEREIRA,ABIERTA,ABIERTA
100.0,03-01-0151-46,03-01-0152-46,COLEGIO MIXTO PRE-UNIVERSITARIO GALILEO GALILEI,COLEGIO MIXTO PRE-UNIVERSITARIO GALILEO GALILEI,DOBLE,DOBLE,MONOLINGUE,MONOLINGUE,FIN DE SEMANA,FIN DE SEMANA,JUAN RAMON MARROQUIN GOMEZ,JUAN RAMON MARROQUIN GOMEZ,CERRADA DEFINITIVAMENTE,CERRADA DEFINITIVAMENTE
100.0,18-05-0084-46,18-05-0117-46,CENTRO EDUCATIVO MAYA,CENTRO EDUCATIVO MAYA,VESPERTINA,VESPERTINA,MONOLINGUE,MONOLINGUE,DIARIO(REGULAR),DIARIO(REGULAR),HÉCTOR REYNALDO GÓMEZ AGUILAR,HÉCTOR REYNALDO GÓMEZ AGUILAR,ABIERTA,ABIERTA
100.0,11-05-0025-46,11-05-0027-46,COLEGIO EVANGELICO MIXTO NUEVA ESPERANZA,COLEGIO EVANGELICO MIXTO NUEVA ESPERANZA,DOBLE,DOBLE,MONOLINGUE,MONOLINGUE,FIN DE SEMANA,FIN DE SEMANA,OSCAR WALDEMAR MONZON PACHECHO,OSCAR WALDEMAR MONZON PACHECHO,ABIERTA,ABIERTA
100.0,11-02-0011-46,11-02-0013-46,CENTRO EDUCATIVO DE ESTUDIOS INTEGRADOS SAN SEBASTIAN CEEDISS,CENTRO EDUCATIVO DE ESTUDIOS INTEGRADOS SAN SEBASTIAN CEEDISS,DOBLE,DOBLE,MONOLINGUE,MONOLINGUE,FIN DE SEMANA,FIN DE SEMANA,MELVIN RAFAEL REYES LÓPEZ,MELVIN RAFAEL REYES LÓPEZ,ABIERTA,ABIERTA
100.0,11-01-0523-46,11-01-0534-46,"COLEGIO TECNOLÓGICO CENTROAMERICANO ""COLTEC""","COLEGIO TECNOLÓGICO CENTROAMERICANO ""COLTEC""",MATUTINA,MATUTINA,MONOLINGUE,MONOLINGUE,VIRTUAL A DISTANCIA,VIRTUAL A DISTANCIA,NORMA KARINA YEÉ OLIVA,NORMA KARINA YEÉ OLIVA,ABIERTA,ABIERTA
100.0,11-01-0452-46,11-01-0453-46,COLEGIO MIXTO MARIO MONTEFORTE TOLEDO,COLEGIO MIXTO MARIO MONTEFORTE TOLEDO,DOBLE,DOBLE,MONOLINGUE,MONOLINGUE,FIN DE SEMANA,FIN DE SEMANA,GLENDA JEANETTE CHÁVEZ GÓMEZ,GLENDA JEANETTE CHÁVEZ GÓMEZ,ABIERTA,ABIERTA
100.0,11-01-0427-46,11-01-0429-46,LICEO CRISTIANO MIXTO LA FE,LICEO CRISTIANO MIXTO LA FE,DOBLE,DOBLE,MONOLINGUE,MONOLINGUE,FIN DE SEMANA,FIN DE SEMANA,GLEIDI YOMARA SÁNCHEZ RAMÍREZ,GLEIDI YOMARA SÁNCHEZ RAMÍREZ,CERRADA TEMPORALMENTE,CERRADA TEMPORALMENTE
100.0,11-01-0387-46,11-01-0388-46,"COLEGIO PRIVADO MIXTO ""CABALLO BLANCO""","COLEGIO PRIVADO MIXTO ""CABALLO BLANCO""",DOBLE,DOBLE,MONOLINGUE,MONOLINGUE,FIN DE SEMANA,FIN DE SEMANA,HÉCTOR JULIÁN RODAS MAZARIEGOS,HÉCTOR JULIÁN RODAS MAZARIEGOS,ABIERTA,ABIERTA
100.0,11-01-0383-46,11-01-0384-46,"COLEGIO MIXTO ""LUIS FERNANDO ESQUIVEL SANCHEZ""","COLEGIO MIXTO ""LUIS FERNANDO ESQUIVEL SANCHEZ""",DOBLE,DOBLE,MONOLINGUE,MONOLINGUE,FIN DE SEMANA,FIN DE SEMANA,PATRICIA ELIZABETH DE LEÓN SAMAYOA,PATRICIA ELIZABETH DE LEÓN SAMAYOA,ABIERTA,ABIERTA
100.0,11-01-0321-46,11-01-0327-46,"COLEGIO EVANGÉLICO MIXTO "" PALABRA VIVA ""","COLEGIO EVANGÉLICO MIXTO "" PALABRA VIVA """,DOBLE,DOBLE,MONOLINGUE,MONOLINGUE,FIN DE SEMANA,FIN DE SEMANA,OLIMPIA DEL PILAR CARDOZA REYES,OLIMPIA DEL PILAR CARDOZA REYES,ABIERTA,ABIERTA
100.0,14-20-0162-46,14-20-5530-46,INSTITUTO DIVERSIFICADO MAYA PADRE GUILLERMO WOODS,INSTITUTO DIVERSIFICADO MAYA PADRE GUILLERMO WOODS,MATUTINA,MATUTINA,BILINGUE,BILINGUE,DIARIO(REGULAR),DIARIO(REGULAR),TEODORO RAMÍREZ VELÁSQUEZ,TEODORO RAMÍREZ VELÁSQUEZ,ABIERTA,ABIERTA
100.0,11-01-0310-46,11-01-0312-46,"COLEGIO MIXTO CRISTIANO ""GETSEMANÍ""","COLEGIO MIXTO CRISTIANO ""GETSEMANÍ""",DOBLE,DOBLE,MONOLINGUE,MONOLINGUE,FIN DE SEMANA,FIN DE SEMANA,KEILY MABEL RIVERA CAMPOS,KEILY MABEL RIVERA CAMPOS,CERRADA TEMPORALMENTE,CERRADA TEMPORALMENTE
100.0,11-01-0306-46,11-01-0308-46,COLEGIO MIXTO EN COMPUTACIÓN LA MERCED,COLEGIO MIXTO EN COMPUTACIÓN LA MERCED,DOBLE,DOBLE,MONOLINGUE,MONOLINGUE,FIN DE SEMANA,FIN DE SEMANA,MARJORY VANESSA CABRERA ELÍAS,MARJORY VANESSA CABRERA ELÍAS,ABIERTA,ABIERTA
100.0,11-01-0271-46,11-01-0272-46,"COLEGIO TECNOLÓGICO ""BLAISE PASCAL""","COLEGIO TECNOLÓGICO ""BLAISE PASCAL""",DOBLE,DOBLE,MONOLINGUE,MONOLINGUE,FIN DE SEMANA,FIN DE SEMANA,YÉNIFFER ANALY MAKEPEACE RUIZ,YÉNIFFER ANALY MAKEPEACE RUIZ,ABIERTA,ABIERTA
100.0,11-01-0255-46,11-01-0397-46,CENTRO EDUCATIVO NUEVA CANDELARIA,CENTRO EDUCATIVO NUEVA CANDELARIA,DOBLE,DOBLE,MONOLINGUE,MONOLINGUE,FIN DE SEMANA,FIN DE SEMANA,OSVALDO ZACARÍAS ICHEL,OSVALDO ZACARÍAS ICHEL,ABIERTA,ABIERTA
100.0,03-01-1335-46,03-01-1336-46,LICEO DE COMPUTACION CIENCIA Y TECNOLOGIA,LICEO DE COMPUTACION CIENCIA Y TECNOLOGIA,DOBLE,DOBLE,MONOLINGUE,MONOLINGUE,FIN DE SEMANA,FIN DE SEMANA,DESCONOCIDO,DESCONOCIDO,CERRADA DEFINITIVAMENTE,CERRADA DEFINITIVAMENTE
100.0,03-04-0005-46,03-04-0060-46,CENTRO EDUCATIVO TERRA MAYA EMANUEL TEM,CENTRO EDUCATIVO TERRA MAYA EMANUEL TEM,DOBLE,DOBLE,MONOLINGUE,MONOLINGUE,FIN DE SEMANA,FIN DE SEMANA,GLADYS ELIZABETH BURRIÓN BURRIÓN,GLADYS ELIZABETH BURRIÓN BURRIÓN,ABIERTA,ABIERTA
100.0,09-01-3556-46,09-01-3816-46,"COLEGIO PRE-UNIVERSITARIO ""FRIEDRICH VON HAYEK""","COLEGIO PRE-UNIVERSITARIO ""FRIEDRICH VON HAYEK""",MATUTINA,MATUTINA,MONOLINGUE,MONOLINGUE,DIARIO(REGULAR),DIARIO(REGULAR),EDILSAR ROCAEL VAZQUEZ PEREZ,EDILSAR ROCAEL VAZQUEZ PEREZ,ABIERTA,ABIERTA
100.0,03-06-0015-46,03-06-0016-46,CENTRO EDUCATIVO LICEO EL CARMEN,CENTRO EDUCATIVO LICEO EL CARMEN,DOBLE,DOBLE,MONOLINGUE,MONOLINGUE,FIN DE SEMANA,FIN DE SEMANA,CLAUDIA ELIZABETH CRUZ ROSALES,CLAUDIA ELIZABETH CRUZ ROSALES,CERRADA TEMPORALMENTE,CERRADA TEMPORALMENTE
100.0,12-12-0078-46,12-12-0083-46,"COLEGIO CIENTÍFICO ""GALILEO""","COLEGIO CIENTÍFICO ""GALILEO""",DOBLE,DOBLE,MONOLINGUE,MONOLINGUE,FIN DE SEMANA,FIN DE SEMANA,GLADIS JUSTINA MUÑOZ DE LEÓN,GLADIS JUSTINA MUÑOZ DE LEÓN,ABIERTA,ABIERTA
100.0,12-12-0069-46,12-12-0082-46,"COLEGIO CIENTÍFICO ""GALILEO""","COLEGIO CIENTÍFICO ""GALILEO""",VESPERTINA,VESPERTINA,MONOLINGUE,MONOLINGUE,DIARIO(REGULAR),DIARIO(REGULAR),GLADIS JUSTINA MUÑOZ DE LEÓN,GLADIS JUSTINA MUÑOZ DE LEÓN,ABIERTA,ABIERTA
100.0,18-05-0152-46,18-05-0154-46,CENTRO EDUCATIVO MAYA,CENTRO EDUCATIVO MAYA,NOCTURNA,NOCTURNA,MONOLINGUE,MONOLINGUE,DIARIO(REGULAR),DIARIO(REGULAR),HÉCTOR REYNALDO GÓMEZ AGUILAR,HÉCTOR REYNALDO GÓMEZ AGUILAR,ABIERTA,ABIERTA
100.0,09-04-0033-46,09-04-0034-46,INSTITUTO DIVERSIFICADO POR COOPERATIVA DE ENSEÑANZA MAXIMO RAUL GIRON MAZARIEGOS,INSTITUTO DIVERSIFICADO POR COOPERATIVA DE ENSEÑANZA MAXIMO RAUL GIRON MAZARIEGOS,VESPERTINA,VESPERTINA,MONOLINGUE,MONOLINGUE,DIARIO(REGULAR),DIARIO(REGULAR),FRANCISCO RULAMAN CIFUENTES MÉNDEZ,FRANCISCO RULAMAN CIFUENTES MÉNDEZ,ABIERTA,ABIERTA
100.0,09-20-0063-46,09-20-0661-46,"INSTITUTO PARTICULAR MIXTO ""PEDRO MOLINA""","INSTITUTO PARTICULAR MIXTO ""PEDRO MOLINA""",NOCTURNA,NOCTURNA,MONOLINGUE,MONOLINGUE,DIARIO(REGULAR),DIARIO(REGULAR),JULIA PATRICIA HERNÁNDEZ VALDEZ,JULIA PATRICIA HERNÁNDEZ VALDEZ,CERRADA TEMPORALMENTE,CERRADA TEMPORALMENTE
100.0,18-04-0441-46,18-04-0442-46,"INSTITUTO PRIVADO MIXTO ""DEJANDO HUELLA""","INSTITUTO PRIVADO MIXTO ""DEJANDO HUELLA""",DOBLE,DOBLE,MONOLINGUE,MONOLINGUE,FIN DE SEMANA,FIN DE SEMANA,ADONIA MARISOL LÓPEZ GUERRA,ADONIA MARISOL LÓPEZ GUERRA,ABIERTA,ABIERTA
100.0,18-04-0462-46,18-04-0463-46,INSTITUTO PRIVADO MIXTO DR. JUAN JOSE AREVALO BERMEJO,INSTITUTO PRIVADO MIXTO DR. JUAN JOSE AREVALO BERMEJO,DOBLE,DOBLE,MONOLINGUE,MONOLINGUE,FIN DE SEMANA,FIN DE SEMANA,DORA AMELIA MOSCOSO Y MOSCOSO,DORA AMELIA MOSCOSO Y MOSCOSO,ABIERTA,ABIERTA
100.0,12-07-0213-46,12-07-0214-46,"INSTITUTO TECNOLÓGICO ""ESPERANZA""","INSTITUTO TECNOLÓGICO ""ESPERANZA""",DOBLE,DOBLE,MONOLINGUE,MONOLINGUE,FIN DE SEMANA,FIN DE SEMANA,ANGELICA FULVIA MORALES PÉREZ,ANGELICA FULVIA MORALES PÉREZ,CERRADA TEMPORALMENTE,CERRADA TEMPORALMENTE
100.0,12-02-0131-46,12-02-4727-46,"INSTITUTO PARTICULAR MIXTO ""MINERVA""","INSTITUTO PARTICULAR MIXTO ""MINERVA""",DOBLE,DOBLE,MONOLINGUE,MONOLINGUE,FIN DE SEMANA,FIN DE SEMANA,DEMECIO HERCULANO OROZCO GONZÁLEZ,DEMECIO HERCULANO OROZCO GONZÁLEZ,CERRADA TEMPORALMENTE,CERRADA TEMPORALMENTE
100.0,12-01-0170-46,12-01-0171-46,"COLEGIO BILINGÜE ""ADVANCE""","COLEGIO BILINGÜE ""ADVANCE""",DOBLE,DOBLE,MONOLINGUE,MONOLINGUE,FIN DE SEMANA,FIN DE SEMANA,YESENIA AZUCENA GÓMEZ ROMERO,YESENIA AZUCENA GÓMEZ ROMERO,CERRADA TEMPORALMENTE,CERRADA TEMPORALMENTE
100.0,09-23-0040-46,09-23-0041-46,COLEGIO IDEA,COLEGIO IDEA,DOBLE,DOBLE,MONOLINGUE,MONOLINGUE,A DISTANCIA,A DISTANCIA,JORGE LUIS FERNÁNDEZ SOTOVANDO,JORGE LUIS FERNÁNDEZ SOTOVANDO,CERRADA TEMPORALMENTE,CERRADA TEMPORALMENTE
100.0,03-15-0011-46,03-15-0013-46,CENTRO EDUCATIVO MIXTO GUATEMALTECO CESAR BRAÑAS,CENTRO EDUCATIVO MIXTO GUATEMALTECO CESAR BRAÑAS,DOBLE,DOBLE,MONOLINGUE,MONOLINGUE,FIN DE SEMANA,FIN DE SEMANA,FAUSTO RAFAEL HERNÁNDEZ FLORES,FAUSTO RAFAEL HERNÁNDEZ FLORES,CERRADA DEFINITIVAMENTE,CERRADA DEFINITIVAMENTE
100.0,03-13-0012-46,03-13-0019-46,COLEGIO MIXTO SAN MIGUEL ARCANGEL,COLEGIO MIXTO SAN MIGUEL ARCANGEL,DOBLE,DOBLE,MONOLINGUE,MONOLINGUE,FIN DE SEMANA,FIN DE SEMANA,LISBETH ESPAÑA MEJÍA,LISBETH ESPAÑA MEJÍA,CERRADA TEMPORALMENTE,CERRADA TEMPORALMENTE
100.0,03-12-0034-46,03-12-0035-46,CENTRO DE ESTUDIOS CIUDAD VIEJA,CENTRO DE ESTUDIOS CIUDAD VIEJA,DOBLE,DOBLE,MONOLINGUE,MONOLINGUE,FIN DE SEMANA,FIN DE SEMANA,ANA LOURDES ASTURIAS PALENCIA,ANA LOURDES ASTURIAS PALENCIA,CERRADA TEMPORALMENTE,CERRADA TEMPORALMENTE
100.0,03-09-0056-46,03-09-0057-46,CENTRO EDUCATIVO BILINGUE FASE,CENTRO EDUCATIVO BILINGUE FASE,MATUTINA,MATUTINA,MONOLINGUE,MONOLINGUE,VIRTUAL A DISTANCIA,VIRTUAL A DISTANCIA,STEPHANIE LUCY VALDEZ GONZÁLEZ,STEPHANIE LUCY VALDEZ GONZÁLEZ,ABIERTA,ABIERTA
100.0,18-04-0405-46,18-04-0406-46,"COLEGIO PRIVADO MIXTO ""JIREH""","COLEGIO PRIVADO MIXTO ""JIREH""",DOBLE,DOBLE,MONOLINGUE,MONOLINGUE,FIN DE SEMANA,FIN DE SEMANA,EDGAR ROLANDO MORALES DE PAZ,EDGAR ROLANDO MORALES DE PAZ,ABIERTA,ABIERTA
100.0,10-12-0009-46,10-12-0010-46,COLEGIO PRIVADO MIXTO INNOVACION EDUCATIVA,COLEGIO PRIVADO MIXTO INNOVACION EDUCATIVA,DOBLE,DOBLE,MONOLINGUE,MONOLINGUE,FIN DE SEMANA,FIN DE SEMANA,ANGELICA MARIA SEM XICAY,ANGELICA MARIA SEM XICAY,ABIERTA,ABIERTA
100.0,18-05-0086-46,18-05-0118-46,CENTRO EDUCATIVO MAYA,CENTRO EDUCATIVO MAYA,DOBLE,DOBLE,MONOLINGUE,MONOLINGUE,FIN DE SEMANA,FIN DE SEMANA,HÉCTOR REYNALDO GÓMEZ AGUILAR,HÉCTOR REYNALDO GÓMEZ AGUILAR,ABIERTA,ABIERTA
100.0,00-01-0366-46,00-01-2908-46,"INSTITUTO PARTICULAR MIXTO ""CIENCIA Y DESARROLLO""","INSTITUTO PARTICULAR MIXTO ""CIENCIA Y DESARROLLO""",DOBLE,DOBLE,MONOLINGUE,MONOLINGUE,FIN DE SEMANA,FIN DE SEMANA,MYRIAM JEANNETTE CIFUENTES ORTIZ,MYRIAM JEANNETTE CIFUENTES ORTIZ,CERRADA TEMPORALMENTE,CERRADA TEMPORALMENTE
100.0,00-01-0318-46,00-01-0595-46,LICEO HISPANOAMERICANO NO. 2,LICEO HISPANOAMERICANO NO. 2,MATUTINA,MATUTINA,MONOLINGUE,MONOLINGUE,DIARIO(REGULAR),DIARIO(REGULAR),MARÍA ISABEL POLANCO PAZ,MARÍA ISABEL POLANCO PAZ,ABIERTA,ABIERTA
100.0,22-06-0020-46,22-06-0037-46,LICEO YUPANO,LICEO YUPANO,DOBLE,DOBLE,MONOLINGUE,MONOLINGUE,FIN DE SEMANA,FIN DE SEMANA,INMER WILFREDO VELÁSQUEZ DOMÍNGUEZ,INMER WILFREDO VELÁSQUEZ DOMÍNGUEZ,ABIERTA,ABIERTA
100.0,00-01-0266-46,00-02-7035-46,LICEO DE COMPUTACION C.S.S.,LICEO DE COMPUTACION C.S.S.,INTERMEDIA,INTERMEDIA,MONOLINGUE,MONOLINGUE,DIARIO(REGULAR),DIARIO(REGULAR),DESCONOCIDO,DESCONOCIDO,CERRADA TEMPORALMENTE,CERRADA TEMPORALMENTE
100.0,18-01-0306-46,18-01-0308-46,"INSTITUTO INTERCULTURAL MIXTO ""KATOK WINAQ""","INSTITUTO INTERCULTURAL MIXTO ""KATOK WINAQ""",DOBLE,DOBLE,MONOLINGUE,MONOLINGUE,IRREGULAR,IRREGULAR,CINTHYA MARIBEL DIAZ ALDANA,CINTHYA MARIBEL DIAZ ALDANA,CERRADA TEMPORALMENTE,CERRADA TEMPORALMENTE
100.0,22-13-0032-46,22-13-0033-46,LICEO SAN PEDRO,LICEO SAN PEDRO,DOBLE,DOBLE,MONOLINGUE,MONOLINGUE,FIN DE SEMANA,FIN DE SEMANA,DELMY LILÍ RAMÍREZ GONZÁLEZ,DELMY LILÍ RAMÍREZ GONZÁLEZ,ABIERTA,ABIERTA
100.0,22-14-0080-46,22-14-0082-46,"INSTITUTO MIXTO DE EDUCACIÓN DE ORIENTE ""IMIDEO NÉRICI""","INSTITUTO MIXTO DE EDUCACIÓN DE ORIENTE ""IMIDEO NÉRICI""",DOBLE,DOBLE,MONOLINGUE,MONOLINGUE,FIN DE SEMANA,FIN DE SEMANA,MERCY MARÍA GÓMEZ RUANO,MERCY MARÍA GÓMEZ RUANO,ABIERTA,ABIERTA
100.0,22-17-0038-46,22-17-0039-46,"COLEGIO INTEGRAL DE COMPUTACIÓN ""EDUCARE""","COLEGIO INTEGRAL DE COMPUTACIÓN ""EDUCARE""",DOBLE,DOBLE,MONOLINGUE,MONOLINGUE,FIN DE SEMANA,FIN DE SEMANA,SENDER MAURICIO SOTO VÁSQUEZ,SENDER MAURICIO SOTO VÁSQUEZ,ABIERTA,ABIERTA
100.0,16-03-9884-46,16-03-9885-46,LICEO SAN CRISTOBAL,LICEO SAN CRISTOBAL,VESPERTINA,VESPERTINA,MONOLINGUE,MONOLINGUE,DIARIO(REGULAR),DIARIO(REGULAR),CRISTÓBAL MORÁN MO,CRISTÓBAL MORÁN MO,ABIERTA,ABIERTA
100.0,17-03-0098-46,17-03-0099-46,LICEO INTEGRAL NUEVA GENERACION - LING-,LICEO INTEGRAL NUEVA GENERACION - LING-,DOBLE,DOBLE,MONOLINGUE,MONOLINGUE,FIN DE SEMANA,FIN DE SEMANA,MIGUEL ANGEL MEJIA FLORES,MIGUEL ANGEL MEJIA FLORES,ABIERTA,ABIERTA
100.0,17-03-0120-46,17-03-0121-46,COLEGIO PRIVADO MIXTO EL FORMADOR,COLEGIO PRIVADO MIXTO EL FORMADOR,DOBLE,DOBLE,MONOLINGUE,MONOLINGUE,FIN DE SEMANA,FIN DE SEMANA,JUAN CARLOS MONZON LUTIN,JUAN CARLOS MONZON LUTIN,ABIERTA,ABIERTA
100.0,20-01-2349-46,20-01-2351-46,LICEO TECNOCIENCIA BILINGUE DE CHIQUIMULA,LICEO TECNOCIENCIA BILINGUE DE CHIQUIMULA,DOBLE,DOBLE,MONOLINGUE,MONOLINGUE,FIN DE SEMANA,FIN DE SEMANA,DESCONOCIDO,DESCONOCIDO,CERRADA TEMPORALMENTE,CERRADA TEMPORALMENTE
100.0,17-05-0232-46,17-05-0234-46,LICEO MIXTO MODERNO SANTA FE,LICEO MIXTO MODERNO SANTA FE,VESPERTINA,VESPERTINA,MONOLINGUE,MONOLINGUE,DIARIO(REGULAR),DIARIO(REGULAR),DELMY GABRIELA LUNA SIERRA,DELMY GABRIELA LUNA SIERRA,ABIERTA,ABIERTA
100.0,18-01-0350-46,18-01-0351-46,"COLEGIO TECNICO PRIVADO MIXTO ""SAN JOSE""","COLEGIO TECNICO PRIVADO MIXTO ""SAN JOSE""",DOBLE,DOBLE,MONOLINGUE,MONOLINGUE,FIN DE SEMANA,FIN DE SEMANA,LUIS ALBERTO CARCAMO PEÑA,LUIS ALBERTO CARCAMO PEÑA,CERRADA TEMPORALMENTE,CERRADA TEMPORALMENTE
100.0,18-01-0377-46,18-01-0378-46,"INSTITUTO PARTICULAR MIXTO ""ADONAI""","INSTITUTO PARTICULAR MIXTO ""ADONAI""",DOBLE,DOBLE,MONOLINGUE,MONOLINGUE,FIN DE SEMANA,FIN DE SEMANA,SANDRA PATRICIA LÓPEZ JORDÁN,SANDRA PATRICIA LÓPEZ JORDÁN,ABIERTA,ABIERTA
100.0,04-12-0043-46,04-12-0051-46,INSTITUTO PRIVADO MIXTO ORIZABA,INSTITUTO PRIVADO MIXTO ORIZABA,DOBLE,DOBLE,MONOLINGUE,MONOLINGUE,FIN DE SEMANA,FIN DE SEMANA,DOUGLAS ROMEO LOPEZ ORIZABA,DOUGLAS ROMEO LOPEZ ORIZABA,ABIERTA,ABIERTA
100.0,18-01-0254-46,18-01-0256-46,INSTITUTO MIXTO INTEGRAL MARIA CHINCHILLA,INSTITUTO MIXTO INTEGRAL MARIA CHINCHILLA,DOBLE,DOBLE,MONOLINGUE,MONOLINGUE,FIN DE SEMANA,FIN DE SEMANA,WALTER FRANCISCO LÓPEZ TOBAR,WALTER FRANCISCO LÓPEZ TOBAR,CERRADA TEMPORALMENTE,CERRADA TEMPORALMENTE
100.0,00-01-0376-46,00-01-0377-46,LICEO TECNICO INTEGRAL SANTA TERESA DE JESUS,LICEO TECNICO INTEGRAL SANTA TERESA DE JESUS,DOBLE,DOBLE,MONOLINGUE,MONOLINGUE,FIN DE SEMANA,FIN DE SEMANA,SILVIA SUSANA SALAZAR SOTO,SILVIA SUSANA SALAZAR SOTO,ABIERTA,ABIERTA
100.0,04-06-3151-46,04-06-3152-46,COLEGIO EVANGELICO ISRAEL,COLEGIO EVANGELICO ISRAEL,DOBLE,DOBLE,MONOLINGUE,MONOLINGUE,FIN DE SEMANA,FIN DE SEMANA,CÁNDIDA ROSA CORADO RIVERA,CÁNDIDA ROSA CORADO RIVERA,ABIERTA,ABIERTA
100.0,00-01-0407-46,00-01-0409-46,LICEO METROPOLITANO EN COMPUTACION III,LICEO METROPOLITANO EN COMPUTACION III,DOBLE,DOBLE,MONOLINGUE,MONOLINGUE,FIN DE SEMANA,FIN DE SEMANA,MARGARITA DE JESUS BARRIOS CASTILLO,MARGARITA DE JESUS BARRIOS CASTILLO,CERRADA TEMPORALMENTE,CERRADA TEMPORALMENTE
100.0,18-01-0182-46,18-01-0185-46,"INSTITUTO PARTICULAR MIXTO ""DESARROLLO Y CIENCIA""","INSTITUTO PARTICULAR MIXTO ""DESARROLLO Y CIENCIA""",DOBLE,DOBLE,MONOLINGUE,MONOLINGUE,FIN DE SEMANA,FIN DE SEMANA,EDGAR ROMEO MARTÍNEZ CÁCERES,EDGAR ROMEO MARTÍNEZ CÁCERES,ABIERTA,ABIERTA
100.0,18-01-0209-46,18-01-0210-46,"CENTRO EDUCATIVO ""LICEO CENTROAMERICANO""","CENTRO EDUCATIVO ""LICEO CENTROAMERICANO""",DOBLE,DOBLE,MONOLINGUE,MONOLINGUE,FIN DE SEMANA,FIN DE SEMANA,WALTER DANILO MONTERROSO JIMÉNEZ,WALTER DANILO MONTERROSO JIMÉNEZ,CERRADA DEFINITIVAMENTE,CERRADA DEFINITIVAMENTE
100.0,00-01-0581-46,00-01-4336-46,LICEO SAN ANTONIO,LICEO SAN ANTONIO,MATUTINA,MATUTINA,MONOLINGUE,MONOLINGUE,DIARIO(REGULAR),DIARIO(REGULAR),IRMA LETICIA BOLAÑOS SAMAYOA,IRMA LETICIA BOLAÑOS SAMAYOA,CERRADA DEFINITIVAMENTE,CERRADA DEFINITIVAMENTE
100.0,22-02-0017-46,22-02-2087-46,"COLEGIO PARTICULAR MIXTO ""LICEO PROGRESO""","COLEGIO PARTICULAR MIXTO ""LICEO PROGRESO""",DOBLE,DOBLE,MONOLINGUE,MONOLINGUE,FIN DE SEMANA,FIN DE SEMANA,NELDA JUDITH PALMA ESTRADA,NELDA JUDITH PALMA ESTRADA,ABIERTA,ABIERTA
100.0,18-01-0232-46,18-01-0287-46,CENTRO EDUCATIVO CONCEPCION DE MARIA,CENTRO EDUCATIVO CONCEPCION DE MARIA,DOBLE,DOBLE,MONOLINGUE,MONOLINGUE,FIN DE SEMANA,FIN DE SEMANA,EVELYN MARILU FRANCO ALDANA,EVELYN MARILU FRANCO ALDANA,CERRADA TEMPORALMENTE,CERRADA TEMPORALMENTE
100.0,00-01-0534-46,00-01-9773-46,INSTITUTO GUILLERMO PUTZEYS ÁLVAREZ,INSTITUTO GUILLERMO PUTZEYS ÁLVAREZ,DOBLE,DOBLE,MONOLINGUE,MONOLINGUE,FIN DE SEMANA,FIN DE SEMANA,JOSÉ RODERICO TELLO TELLO,JOSÉ RODERICO TELLO TELLO,ABIERTA,ABIERTA
100.0,00-01-0520-46,00-01-0521-46,"""LICEO MONTE SINAÍ""","""LICEO MONTE SINAÍ""",MATUTINA,MATUTINA,MONOLINGUE,MONOLINGUE,FIN DE SEMANA,FIN DE SEMANA,ISABEL ROBEDDI VALLAR TORRES,ISABEL ROBEDDI VALLAR TORRES,ABIERTA,ABIERTA
100.0,16-16-0135-46,16-16-0139-46,LICEO CRISTIANO EBENEZER,LICEO CRISTIANO EBENEZER,MATUTINA,MATUTINA,MONOLINGUE,MONOLINGUE,DIARIO(REGULAR),DIARIO(REGULAR),LIDIA TIUL CAAL,LIDIA TIUL CAAL,ABIERTA,ABIERTA
100.0,00-01-0468-46,00-01-0475-46,LICEO INTEGRAL BILINGUE LAN-DER,LICEO INTEGRAL BILINGUE LAN-DER,DOBLE,DOBLE,MONOLINGUE,MONOLINGUE,FIN DE SEMANA,FIN DE SEMANA,ROSSANA VERONICA TELON OTZOY,ROSSANA VERONICA TELON OTZOY,CERRADA DEFINITIVAMENTE,CERRADA DEFINITIVAMENTE
100.0,00-01-0467-46,00-01-0475-46,LICEO INTEGRAL BILINGUE LAN-DER,LICEO INTEGRAL BILINGUE LAN-DER,DOBLE,DOBLE,MONOLINGUE,MONOLINGUE,FIN DE SEMANA,FIN DE SEMANA,ROSSANA VERONICA TELON OTZOY,ROSSANA VERONICA TELON OTZOY,CERRADA DEFINITIVAMENTE,CERRADA DEFINITIVAMENTE
100.0,00-01-0467-46,00-01-0468-46,LICEO INTEGRAL BILINGUE LAN-DER,LICEO INTEGRAL BILINGUE LAN-DER,DOBLE,DOBLE,MONOLINGUE,MONOLINGUE,FIN DE SEMANA,FIN DE SEMANA,ROSSANA VERONICA TELON OTZOY,ROSSANA VERONICA TELON OTZOY,CERRADA DEFINITIVAMENTE,CERRADA DEFINITIVAMENTE
100.0,22-06-0011-46,22-06-0021-46,"COLEGIO PARTICULAR MIXTO ""BRISAS DEL CHINGO""","COLEGIO PARTICULAR MIXTO ""BRISAS DEL CHINGO""",DOBLE,DOBLE,MONOLINGUE,MONOLINGUE,FIN DE SEMANA,FIN DE SEMANA,ESTRELLA SOLEDAD CORADO GARCIA,ESTRELLA SOLEDAD CORADO GARCIA,ABIERTA,ABIERTA
100.0,00-01-0458-46,00-01-0460-46,LICEO CULTURAL ESPAÑOL,LICEO CULTURAL ESPAÑOL,DOBLE,DOBLE,MONOLINGUE,MONOLINGUE,FIN DE SEMANA,FIN DE SEMANA,ELDER ALCIDES REGALADO LEMUS,ELDER ALCIDES REGALADO LEMUS,ABIERTA,ABIERTA
100.0,00-01-0440-46,00-01-0441-46,LICEO MULTICULTURAL GUATEMALTECO,LICEO MULTICULTURAL GUATEMALTECO,DOBLE,DOBLE,MONOLINGUE,MONOLINGUE,FIN DE SEMANA,FIN DE SEMANA,JOSE RICARDO REYES MORA,JOSE RICARDO REYES MORA,CERRADA TEMPORALMENTE,CERRADA TEMPORALMENTE
100.0,18-01-0242-46,18-01-0243-46,INSTITUTO PARTICULAR MIXTO JOSE MARIA BONILLA RUANO,INSTITUTO PARTICULAR MIXTO JOSE MARIA BONILLA RUANO,DOBLE,DOBLE,MONOLINGUE,MONOLINGUE,FIN DE SEMANA,FIN DE SEMANA,GUSTAVO GUMERCINDO RODAS MAZARIEGOS,GUSTAVO GUMERCINDO RODAS MAZARIEGOS,ABIERTA,ABIERTA
100.0,17-10-0207-46,17-10-0248-46,"COLEGIO PRIVADO MIXTO ""JACOBO ARBENZ GUZMAN""","COLEGIO PRIVADO MIXTO ""JACOBO ARBENZ GUZMAN""",VESPERTINA,VESPERTINA,MONOLINGUE,MONOLINGUE,DIARIO(REGULAR),DIARIO(REGULAR),AUGUSTO GARCÍA RIVERA,AUGUSTO GARCÍA RIVERA,ABIERTA,ABIERTA
100.0,04-03-0218-46,04-03-0229-46,COLEGIO PRIVADO EL VALLE,COLEGIO PRIVADO EL VALLE,DOBLE,DOBLE,MONOLINGUE,MONOLINGUE,FIN DE SEMANA,FIN DE SEMANA,OLGA MARINA RUANO GÁMEZ,OLGA MARINA RUANO GÁMEZ,ABIERTA,ABIERTA
100.0,10-13-0039-46,10-13-0040-46,"COLEGIO PRIVADO MIXTO ""SABIDURIA Y EXITO""","COLEGIO PRIVADO MIXTO ""SABIDURIA Y EXITO""",DOBLE,DOBLE,MONOLINGUE,MONOLINGUE,FIN DE SEMANA,FIN DE SEMANA,ROMEO RODRIGUEZ RUBIO,ROMEO RODRIGUEZ RUBIO,ABIERTA,ABIERTA
100.0,10-15-0025-46,10-15-0028-46,"CENTRO DE ESTUDIOS COMUNITARIO DE DIVERSIFICADO ""EL ESFUERZO""","CENTRO DE ESTUDIOS COMUNITARIO DE DIVERSIFICADO ""EL ESFUERZO""",DOBLE,DOBLE,MONOLINGUE,MONOLINGUE,FIN DE SEMANA,FIN DE SEMANA,VICTOR MANUEL MONTERROSO RAMIREZ,VICTOR MANUEL MONTERROSO RAMIREZ,ABIERTA,ABIERTA
100.0,09-01-0132-46,09-01-3534-46,INSTITUTO NORMAL PARA SEÑORITAS DE OCCIDENTE,INSTITUTO NORMAL PARA SEÑORITAS DE OCCIDENTE,VESPERTINA,VESPERTINA,MONOLINGUE,MONOLINGUE,DIARIO(REGULAR),DIARIO(REGULAR),ROSELIA HAYDÉE LÓPEZ MONZÓN,ROSELIA HAYDÉE LÓPEZ MONZÓN,ABIERTA,ABIERTA
100.0,18-04-0204-46,18-04-0205-46,"INSTITUTO PRIVADO MIXTO ""JOSÉ CECILIO DEL VALLE""","INSTITUTO PRIVADO MIXTO ""JOSÉ CECILIO DEL VALLE""",DOBLE,DOBLE,MONOLINGUE,MONOLINGUE,FIN DE SEMANA,FIN DE SEMANA,VÍCTOR MANUEL BONILLA MARROQUIN,VÍCTOR MANUEL BONILLA MARROQUIN,ABIERTA,ABIERTA
100.0,08-01-0237-46,08-01-0241-46,COLEGIO ADVENTISTA MARANATHA,COLEGIO ADVENTISTA MARANATHA,DOBLE,DOBLE,MONOLINGUE,MONOLINGUE,FIN DE SEMANA,FIN DE SEMANA,PATROCINIO ABELINO TZUL BARRENO,PATROCINIO ABELINO TZUL BARRENO,CERRADA TEMPORALMENTE,CERRADA TEMPORALMENTE
100.0,10-20-0026-46,10-20-0034-46,"INSTITUTO PRIVADO MIXTO ""EDUCACION Y DESARROLLO""","INSTITUTO PRIVADO MIXTO ""EDUCACION Y DESARROLLO""",DOBLE,DOBLE,MONOLINGUE,MONOLINGUE,FIN DE SEMANA,FIN DE SEMANA,GERSON ELIAZAR VELASQUEZ VASQUEZ,GERSON ELIAZAR VELASQUEZ VASQUEZ,ABIERTA,ABIERTA
100.0,10-15-0040-46,10-15-0041-46,"COLEGIO PRIVADO MIXTO ""SANTA BARBARA""","COLEGIO PRIVADO MIXTO ""SANTA BARBARA""",DOBLE,DOBLE,MONOLINGUE,MONOLINGUE,FIN DE SEMANA,FIN DE SEMANA,LUIS FERNANDO ACUTA QUIEJ,LUIS FERNANDO ACUTA QUIEJ,ABIERTA,ABIERTA
100.0,09-01-0336-46,09-01-0337-46,"COLEGIO PRIVADO MIXTO ""JUAN JACOBO ROUSSEAU""","COLEGIO PRIVADO MIXTO ""JUAN JACOBO ROUSSEAU""",MATUTINA,MATUTINA,MONOLINGUE,MONOLINGUE,DIARIO(REGULAR),DIARIO(REGULAR),MARLENI AUDELI MEJÍA QUIJIVIX,MARLENI AUDELI MEJÍA QUIJIVIX,ABIERTA,ABIERTA
100.0,16-03-0272-46,16-03-0273-46,COLEGIO DE FORMACIÓN TÉCNICO-PROFESIONAL NEXUS,COLEGIO DE FORMACIÓN TÉCNICO-PROFESIONAL NEXUS,VESPERTINA,VESPERTINA,MONOLINGUE,MONOLINGUE,DIARIO(REGULAR),DIARIO(REGULAR),MARÍA JOSÉ BEJARANO YAGGI,MARÍA JOSÉ BEJARANO YAGGI,CERRADA DEFINITIVAMENTE,CERRADA DEFINITIVAMENTE
100.0,04-01-3253-46,04-01-3254-46,INSTITUTO TECNICO INDUSTRIAL,INSTITUTO TECNICO INDUSTRIAL,MATUTINA,MATUTINA,MONOLINGUE,MONOLINGUE,DIARIO(REGULAR),DIARIO(REGULAR),ASUNCIÓN BOLIVIA MATZER CUXIL,ASUNCIÓN BOLIVIA MATZER CUXIL,CERRADA TEMPORALMENTE,CERRADA TEMPORALMENTE
