similitud,codigo_1,codigo_2,establecimiento_1,establecimiento_2,jornada_1,jornada_2,modalidad_1,modalidad_2,plan_1,plan_2,director_1,director_2,status_1,status_2
100.0,05-13-0070-46,05-13-0079-46,LICEO CRISTIANO NAZARETH,LICEO CRISTIANO NAZARETH,VESPERTINA,VESPERTINA,MONOLINGUE,MONOLINGUE,DIARIO(REGULAR),DIARIO(REGULAR),MANUEL CHINCHILLA CARÍAS,MANUEL CHINCHILLA CARÍAS,ABIERTA,ABIERTA
100.0,05-13-0069-46,05-13-0571-46,LICEO CRISTIANO NAZARETH,LICEO CRISTIANO NAZARETH,VESPERTINA,VESPERTINA,MONOLINGUE,MONOLINGUE,DIARIO(REGULAR),DIARIO(REGULAR),MANUEL CHINCHILLA CARÍAS,MANUEL CHINCHILLA CARÍAS,ABIERTA,ABIERTA
100.0,05-13-0069-46,05-13-0079-46,LICEO CRISTIANO NAZARETH,LICEO CRISTIANO NAZARETH,VESPERTINA,VESPERTINA,MONOLINGUE,MONOLINGUE,DIARIO(REGULAR),DIARIO(REGULAR),MANUEL CHINCHILLA CARÍAS,MANUEL CHINCHILLA CARÍAS,ABIERTA,ABIERTA
100.0,05-13-0069-46,05-13-0070-46,LICEO CRISTIANO NAZARETH,LICEO CRISTIANO NAZARETH,VESPERTINA,VESPERTINA,MONOLINGUE,MONOLINGUE,DIARIO(REGULAR),DIARIO(REGULAR),MANUEL CHINCHILLA CARÍAS,MANUEL CHINCHILLA CARÍAS,ABIERTA,ABIERTA
100.0,05-12-0026-46,05-12-0027-46,"LICEO ""FUENTE DE VIDA""","LICEO ""FUENTE DE VIDA""",DOBLE,DOBLE,MONOLINGUE,MONOLINGUE,FIN DE SEMANA,FIN DE SEMANA,DIOGENES BAUDILIA FIGUEROA CRUZ,DIOGENES BAUDILIA FIGUEROA CRUZ,CERRADA TEMPORALMENTE,CERRADA TEMPORALMENTE
100.0,05-12-0006-46,05-12-0030-46,INSTITUTO NACIONAL DE EDUCACIÓN DIVERSIFICADA,INSTITUTO NACIONAL DE EDUCACIÓN DIVERSIFICADA,MATUTINA,MATUTINA,MONOLINGUE,MONOLINGUE,DIARIO(REGULAR),DIARIO(REGULAR),IRACEMA ANAHY CRUZ OJER,IRACEMA ANAHY CRUZ OJER,ABIERTA,ABIERTA
100.0,01-06-0074-46,01-06-0075-46,INSTITUTO NACIONAL MARIA FERNANDA MEDRANO CORDON,INSTITUTO NACIONAL MARIA FERNANDA MEDRANO CORDON,NOCTURNA,NOCTURNA,MONOLINGUE,MONOLINGUE,DIARIO(REGULAR),DIARIO(REGULAR),CLAUDIA NOEMI MATIAS MOGOLLON,CLAUDIA NOEMI MATIAS MOGOLLON,ABIERTA,ABIERTA
100.0,01-06-9582-46,01-06-9583-46,CENTRO ESTUDIANTIL CRISTIANO JOSE GILBERTO VELASQUEZ,CENTRO ESTUDIANTIL CRISTIANO JOSE GILBERTO VELASQUEZ,DOBLE,DOBLE,MONOLINGUE,MONOLINGUE,FIN DE SEMANA,FIN DE SEMANA,MARTA LAURA FRANCISCA ARÉVALO VELÁSQUEZ,MARTA LAURA FRANCISCA ARÉVALO VELÁSQUEZ,CERRADA TEMPORALMENTE,CERRADA TEMPORALMENTE
100.0,01-08-0236-46,01-08-0237-46,LICEO INTEGRAL BILINGUE LAN-DER,LICEO INTEGRAL BILINGUE LAN-DER,DOBLE,DOBLE,MONOLINGUE,MONOLINGUE,FIN DE SEMANA,FIN DE SEMANA,OMAR UBALDO MARTINEZ HAEGENDORES,OMAR UBALDO MARTINEZ HAEGENDORES,ABIERTA,ABIERTA
100.0,01-08-0346-46,01-08-0348-46,ACADEMIA COMERCIAL E INSTITUTO LOURDES,ACADEMIA COMERCIAL E INSTITUTO LOURDES,DOBLE,DOBLE,MONOLINGUE,MONOLINGUE,FIN DE SEMANA,FIN DE SEMANA,ESTEBAN TOCON XICAY,ESTEBAN TOCON XICAY,ABIERTA,ABIERTA
100.0,01-13-0131-46,01-13-0147-46,CENTRO EDUCATIVO LOS VERDES,CENTRO EDUCATIVO LOS VERDES,MATUTINA,MATUTINA,MONOLINGUE,MONOLINGUE,DIARIO(REGULAR),DIARIO(REGULAR),KRISZTYN HELKIA MORALES BERREONDO,KRISZTYN HELKIA MORALES BERREONDO,ABIERTA,ABIERTA
100.0,01-10-0279-46,01-10-0292-46,CENTRO DE COMPUTACIÓN CEI-PC VILLAS,CENTRO DE COMPUTACIÓN CEI-PC VILLAS,DOBLE,DOBLE,MONOLINGUE,MONOLINGUE,SEMIPRESENCIAL,SEMIPRESENCIAL,ANGÉLICA MARINA ARÉVALO CERÓN,ANGÉLICA MARINA ARÉVALO CERÓN,ABIERTA,ABIERTA
100.0,01-10-0275-46,01-10-0278-46,COLEGIO TECNOLOGICO GUATEMALTECO EDU,COLEGIO TECNOLOGICO GUATEMALTECO EDU,DOBLE,DOBLE,MONOLINGUE,MONOLINGUE,SEMIPRESENCIAL,SEMIPRESENCIAL,VERONICA UBEDO CARRILLO,VERONICA UBEDO CARRILLO,CERRADA TEMPORALMENTE,CERRADA TEMPORALMENTE
100.0,01-09-0006-46,01-09-0007-46,CENTRO EDUCATIVO SAN PEDRO APOSTOL,CENTRO EDUCATIVO SAN PEDRO APOSTOL,DOBLE,DOBLE,MONOLINGUE,MONOLINGUE,FIN DE SEMANA,FIN DE SEMANA,ELSA MAGALY GONZALEZ RODRIGUEZ,ELSA MAGALY GONZALEZ RODRIGUEZ,CERRADA TEMPORALMENTE,CERRADA TEMPORALMENTE
100.0,01-14-0082-46,01-14-0083-46,LICEO MIXTO AMATITLANECO,LICEO MIXTO AMATITLANECO,DOBLE,DOBLE,MONOLINGUE,MONOLINGUE,FIN DE SEMANA,FIN DE SEMANA,LILIAN ROSARIO QUEZADA FERNANDEZ,LILIAN ROSARIO QUEZADA FERNANDEZ,CERRADA DEFINITIVAMENTE,CERRADA DEFINITIVAMENTE
100.0,01-14-6830-46,01-14-7163-46,LICEO CRISTIANO BETH SHALOM,LICEO CRISTIANO BETH SHALOM,DOBLE,DOBLE,MONOLINGUE,MONOLINGUE,FIN DE SEMANA,FIN DE SEMANA,WILLIAMS SALVADOR TRUJILLO CAMBRÁN,WILLIAMS SALVADOR TRUJILLO CAMBRÁN,ABIERTA,ABIERTA
100.0,01-08-8405-46,01-08-8407-46,COLEGIO 'REAL ESPAÑOL',COLEGIO 'REAL ESPAÑOL',VESPERTINA,VESPERTINA,MONOLINGUE,MONOLINGUE,FIN DE SEMANA,FIN DE SEMANA,DESCONOCIDO,DESCONOCIDO,CERRADA TEMPORALMENTE,CERRADA TEMPORALMENTE
100.0,01-08-1079-46,01-08-1081-46,LICEO LOMAS DE SACOJ,LICEO LOMAS DE SACOJ,DOBLE,DOBLE,MONOLINGUE,MONOLINGUE,FIN DE SEMANA,FIN DE SEMANA,HUGO LEONEL SANDOVAL ESTRADA,HUGO LEONEL SANDOVAL ESTRADA,ABIERTA,ABIERTA
100.0,01-08-0737-46,01-08-0739-46,"LICEO TECNOLÓGICO DE GUATEMALA ""ELOHIM""","LICEO TECNOLÓGICO DE GUATEMALA ""ELOHIM""",DOBLE,DOBLE,MONOLINGUE,MONOLINGUE,SEMIPRESENCIAL,SEMIPRESENCIAL,EVELYN ARACELY ZACARÍAS SALAZAR,EVELYN ARACELY ZACARÍAS SALAZAR,ABIERTA,ABIERTA
100.0,01-08-0719-46,01-08-0735-46,COLEGIO NAKBÉ,COLEGIO NAKBÉ,DOBLE,DOBLE,MONOLINGUE,MONOLINGUE,SEMIPRESENCIAL,SEMIPRESENCIAL,DILIA CLARISSA NORIEGA MORALES,DILIA CLARISSA NORIEGA MORALES,ABIERTA,ABIERTA
100.0,01-08-0707-46,01-08-0709-46,CENTRO DE EDUCACIÓN A DISTANCIA ESCOLARIS,CENTRO DE EDUCACIÓN A DISTANCIA ESCOLARIS,DOBLE,DOBLE,MONOLINGUE,MONOLINGUE,A DISTANCIA,A DISTANCIA,WHENDOLYN BETSABE ESTRADA CANIZALES,WHENDOLYN BETSABE ESTRADA CANIZALES,CERRADA DEFINITIVAMENTE,CERRADA DEFINITIVAMENTE
100.0,01-08-0659-46,01-08-0660-46,LICEO TÉCNICO INTERAMERICANO,LICEO TÉCNICO INTERAMERICANO,DOBLE,DOBLE,MONOLINGUE,MONOLINGUE,A DISTANCIA,A DISTANCIA,ANA LUISA ALVARADO SÁNCHEZ DE LAJUJ,ANA LUISA ALVARADO SÁNCHEZ DE LAJUJ,CERRADA TEMPORALMENTE,CERRADA TEMPORALMENTE
100.0,01-14-9722-46,01-14-9724-46,INSTITUTO TECNICO VOCACIONAL PRIVADO AMATITLANECO,INSTITUTO TECNICO VOCACIONAL PRIVADO AMATITLANECO,DOBLE,DOBLE,MONOLINGUE,MONOLINGUE,FIN DE SEMANA,FIN DE SEMANA,ELVIA OTILIA ROSALES CATALÁN,ELVIA OTILIA ROSALES CATALÁN,ABIERTA,ABIERTA
100.0,01-08-0579-46,01-08-0580-46,CENTRO EDUCATIVO PAULO NEVES FREIRE,CENTRO EDUCATIVO PAULO NEVES FREIRE,DOBLE,DOBLE,MONOLINGUE,MONOLINGUE,FIN DE SEMANA,FIN DE SEMANA,LIDIA DUBILIA PATZÁN RAMÍREZ,LIDIA DUBILIA PATZÁN RAMÍREZ,ABIERTA,ABIERTA
100.0,01-08-0575-46,01-08-0576-46,LICEO TECNICO INTERAMERICANO,LICEO TECNICO INTERAMERICANO,DOBLE,DOBLE,MONOLINGUE,MONOLINGUE,FIN DE SEMANA,FIN DE SEMANA,ANA LUISA ALVARADO SÁNCHEZ,ANA LUISA ALVARADO SÁNCHEZ,CERRADA TEMPORALMENTE,CERRADA TEMPORALMENTE
100.0,01-08-0533-46,01-08-7155-46,COLEGIO PRACBIL,COLEGIO PRACBIL,MATUTINA,MATUTINA,MONOLINGUE,MONOLINGUE,DIARIO(REGULAR),DIARIO(REGULAR),LIDIA DUBILIA PATZÁN RAMÍREZ,LIDIA DUBILIA PATZÁN RAMÍREZ,ABIERTA,ABIERTA
100.0,01-08-0437-46,01-08-0439-46,COLEGIO EN COMPUTACIÓN SAN JOSÉ NO. 1,COLEGIO EN COMPUTACIÓN SAN JOSÉ NO. 1,DOBLE,DOBLE,MONOLINGUE,MONOLINGUE,FIN DE SEMANA,FIN DE SEMANA,THELMA PATRICIA HURTADO ZUÑIGA,THELMA PATRICIA HURTADO ZUÑIGA,CERRADA TEMPORALMENTE,CERRADA TEMPORALMENTE
100.0,05-11-0056-46,05-11-0083-46,COLEGIO MIXTO DEL VALLE,COLEGIO MIXTO DEL VALLE,MATUTINA,MATUTINA,MONOLINGUE,MONOLINGUE,DIARIO(REGULAR),DIARIO(REGULAR),MARTHA EMMILSE CUZAN GIL,MARTHA EMMILSE CUZAN GIL,ABIERTA,ABIERTA
100.0,01-15-0612-46,01-15-0626-46,INSTITUTO MIXTO NOCTURNO EL ANGEL,INSTITUTO MIXTO NOCTURNO EL ANGEL,DOBLE,DOBLE,MONOLINGUE,MONOLINGUE,FIN DE SEMANA,FIN DE SEMANA,CINDY JUDITH GARCIA LOAIZA,CINDY JUDITH GARCIA LOAIZA,ABIERTA,ABIERTA
100.0,01-15-0645-46,01-15-0646-46,LICEO TÉCNICO DE VILLA NUEVA,LICEO TÉCNICO DE VILLA NUEVA,MATUTINA,MATUTINA,MONOLINGUE,MONOLINGUE,VIRTUAL A DISTANCIA,VIRTUAL A DISTANCIA,IRIS MARICLO MORALES LUNA,IRIS MARICLO MORALES LUNA,CERRADA TEMPORALMENTE,CERRADA TEMPORALMENTE
100.0,05-06-0034-46,05-06-0051-46,"COLEGIO PRIVADO MIXTO ""BENDICIÓN DEL SABER""","COLEGIO PRIVADO MIXTO ""BENDICIÓN DEL SABER""",VESPERTINA,VESPERTINA,MONOLINGUE,MONOLINGUE,DIARIO(REGULAR),DIARIO(REGULAR),ZOILA ERNESTINA MORALES GODOY,ZOILA ERNESTINA MORALES GODOY,ABIERTA,ABIERTA
100.0,01-15-0813-46,01-15-0816-46,INED INSTITUTO NACIONAL DE EDUCACIÓN DIVERSIFICADA DE BÁRCENA,INED INSTITUTO NACIONAL DE EDUCACIÓN DIVERSIFICADA DE BÁRCENA,NOCTURNA,NOCTURNA,MONOLINGUE,MONOLINGUE,DIARIO(REGULAR),DIARIO(REGULAR),DESCONOCIDO,DESCONOCIDO,TEMPORAL NOMBRAMIENTO,TEMPORAL NOMBRAMIENTO
100.0,05-02-0241-46,05-02-2572-46,LICEO PREUNIVERSITARIO DEL SUR,LICEO PREUNIVERSITARIO DEL SUR,MATUTINA,MATUTINA,MONOLINGUE,MONOLINGUE,DIARIO(REGULAR),DIARIO(REGULAR),CRISTIAN ALEXANDER PÉREZ GONZÁLEZ,CRISTIAN ALEXANDER PÉREZ GONZÁLEZ,ABIERTA,ABIERTA
100.0,05-02-0238-46,05-02-0239-46,COLEGIO CRISTIANO EMMANUEL,COLEGIO CRISTIANO EMMANUEL,VESPERTINA,VESPERTINA,MONOLINGUE,MONOLINGUE,DIARIO(REGULAR),DIARIO(REGULAR),INGRID YANETH OSORIO CAMPOS,INGRID YANETH OSORIO CAMPOS,ABIERTA,ABIERTA
100.0,05-02-0227-46,05-02-0234-46,INSTITUTO PRIVADO MIXTO DE EDUCACION DIVERSIFICADA COLEGIO EVANGELICO 'BETHEL',INSTITUTO PRIVADO MIXTO DE EDUCACION DIVERSIFICADA COLEGIO EVANGELICO 'BETHEL',NOCTURNA,NOCTURNA,MONOLINGUE,MONOLINGUE,DIARIO(REGULAR),DIARIO(REGULAR),DESCONOCIDO,DESCONOCIDO,CERRADA DEFINITIVAMENTE,CERRADA DEFINITIVAMENTE
100.0,05-02-0141-46,05-02-0142-46,CENTRO EDUCATIVO LUCIANO CAMPO REAL,CENTRO EDUCATIVO LUCIANO CAMPO REAL,MATUTINA,MATUTINA,MONOLINGUE,MONOLINGUE,DIARIO(REGULAR),DIARIO(REGULAR),WENDI AZUCENA ABAC BETHANCOURT,WENDI AZUCENA ABAC BETHANCOURT,ABIERTA,ABIERTA
100.0,01-15-0815-46,01-15-0816-46,INED INSTITUTO NACIONAL DE EDUCACIÓN DIVERSIFICADA DE BÁRCENA,INED INSTITUTO NACIONAL DE EDUCACIÓN DIVERSIFICADA DE BÁRCENA,NOCTURNA,NOCTURNA,MONOLINGUE,MONOLINGUE,DIARIO(REGULAR),DIARIO(REGULAR),DESCONOCIDO,DESCONOCIDO,TEMPORAL NOMBRAMIENTO,TEMPORAL NOMBRAMIENTO
100.0,01-15-6571-46,01-15-6572-46,INSTITUTO PRIVADO MIXTO LINDA VISTA,INSTITUTO PRIVADO MIXTO LINDA VISTA,VESPERTINA,VESPERTINA,MONOLINGUE,MONOLINGUE,FIN DE SEMANA,FIN DE SEMANA,DESCONOCIDO,DESCONOCIDO,CERRADA TEMPORALMENTE,CERRADA TEMPORALMENTE
100.0,05-02-0110-46,05-02-0242-46,LICEO PREUNIVERSITARIO DEL SUR,LICEO PREUNIVERSITARIO DEL SUR,VESPERTINA,VESPERTINA,MONOLINGUE,MONOLINGUE,DIARIO(REGULAR),DIARIO(REGULAR),CRISTIAN ALEXANDER PÉREZ GONZÁLEZ,CRISTIAN ALEXANDER PÉREZ GONZÁLEZ,ABIERTA,ABIERTA
100.0,05-02-0093-46,05-02-2402-46,COLEGIO PARTICULAR MIXTO SAGRADO CORAZÓN,COLEGIO PARTICULAR MIXTO SAGRADO CORAZÓN,MATUTINA,MATUTINA,MONOLINGUE,MONOLINGUE,DIARIO(REGULAR),DIARIO(REGULAR),MARÍA DOLORES PÉREZ TUCHÁN,MARÍA DOLORES PÉREZ TUCHÁN,ABIERTA,ABIERTA
100.0,05-02-0092-46,05-02-2402-46,COLEGIO PARTICULAR MIXTO SAGRADO CORAZÓN,COLEGIO PARTICULAR MIXTO SAGRADO CORAZÓN,MATUTINA,MATUTINA,MONOLINGUE,MONOLINGUE,DIARIO(REGULAR),DIARIO(REGULAR),MARÍA DOLORES PÉREZ TUCHÁN,MARÍA DOLORES PÉREZ TUCHÁN,ABIERTA,ABIERTA
100.0,05-02-0092-46,05-02-0093-46,COLEGIO PARTICULAR MIXTO SAGRADO CORAZÓN,COLEGIO PARTICULAR MIXTO SAGRADO CORAZÓN,MATUTINA,MATUTINA,MONOLINGUE,MONOLINGUE,DIARIO(REGULAR),DIARIO(REGULAR),MARÍA DOLORES PÉREZ TUCHÁN,MARÍA DOLORES PÉREZ TUCHÁN,ABIERTA,ABIERTA
100.0,05-02-0090-46,05-02-2402-46,COLEGIO PARTICULAR MIXTO SAGRADO CORAZÓN,COLEGIO PARTICULAR MIXTO SAGRADO CORAZÓN,MATUTINA,MATUTINA,MONOLINGUE,MONOLINGUE,DIARIO(REGULAR),DIARIO(REGULAR),MARÍA DOLORES PÉREZ TUCHÁN,MARÍA DOLORES PÉREZ TUCHÁN,ABIERTA,ABIERTA
100.0,05-02-0090-46,05-02-0093-46,COLEGIO PARTICULAR MIXTO SAGRADO CORAZÓN,COLEGIO PARTICULAR MIXTO SAGRADO CORAZÓN,MATUTINA,MATUTINA,MONOLINGUE,MONOLINGUE,DIARIO(REGULAR),DIARIO(REGULAR),MARÍA DOLORES PÉREZ TUCHÁN,MARÍA DOLORES PÉREZ TUCHÁN,ABIERTA,ABIERTA
100.0,05-02-0090-46,05-02-0092-46,COLEGIO PARTICULAR MIXTO SAGRADO CORAZÓN,COLEGIO PARTICULAR MIXTO SAGRADO CORAZÓN,MATUTINA,MATUTINA,MONOLINGUE,MONOLINGUE,DIARIO(REGULAR),DIARIO(REGULAR),MARÍA DOLORES PÉREZ TUCHÁN,MARÍA DOLORES PÉREZ TUCHÁN,ABIERTA,ABIERTA
100.0,05-02-0087-46,05-02-0088-46,INSTITUTO PARTICULAR MIXTO SAN ANTONIO,INSTITUTO PARTICULAR MIXTO SAN ANTONIO,VESPERTINA,VESPERTINA,MONOLINGUE,MONOLINGUE,DIARIO(REGULAR),DIARIO(REGULAR),JAIME ROGELIO ARCHILA GUERRERO,JAIME ROGELIO ARCHILA GUERRERO,CERRADA DEFINITIVAMENTE,CERRADA DEFINITIVAMENTE
100.0,05-02-0086-46,05-02-0088-46,INSTITUTO PARTICULAR MIXTO SAN ANTONIO,INSTITUTO PARTICULAR MIXTO SAN ANTONIO,VESPERTINA,VESPERTINA,MONOLINGUE,MONOLINGUE,DIARIO(REGULAR),DIARIO(REGULAR),JAIME ROGELIO ARCHILA GUERRERO,JAIME ROGELIO ARCHILA GUERRERO,CERRADA DEFINITIVAMENTE,CERRADA DEFINITIVAMENTE
100.0,05-02-0086-46,05-02-0087-46,INSTITUTO PARTICULAR MIXTO SAN ANTONIO,INSTITUTO PARTICULAR MIXTO SAN ANTONIO,VESPERTINA,VESPERTINA,MONOLINGUE,MONOLINGUE,DIARIO(REGULAR),DIARIO(REGULAR),JAIME ROGELIO ARCHILA GUERRERO,JAIME ROGELIO ARCHILA GUERRERO,CERRADA DEFINITIVAMENTE,CERRADA DEFINITIVAMENTE
100.0,05-05-0085-46,05-05-0086-46,LICEO CRISTIANO LA SABIDURÍA DE LA VIDA,LICEO CRISTIANO LA SABIDURÍA DE LA VIDA,VESPERTINA,VESPERTINA,MONOLINGUE,MONOLINGUE,DIARIO(REGULAR),DIARIO(REGULAR),BLANCA ESTELA CONTRERAS,BLANCA ESTELA CONTRERAS,ABIERTA,ABIERTA
100.0,05-06-0034-46,05-06-0066-46,"COLEGIO PRIVADO MIXTO ""BENDICIÓN DEL SABER""","COLEGIO PRIVADO MIXTO ""BENDICIÓN DEL SABER""",VESPERTINA,VESPERTINA,MONOLINGUE,MONOLINGUE,DIARIO(REGULAR),DIARIO(REGULAR),ZOILA ERNESTINA MORALES GODOY,ZOILA ERNESTINA MORALES GODOY,ABIERTA,ABIERTA
100.0,05-09-0083-46,05-09-0087-46,"COLEGIO PREUNIVERSITARIO ""SAN PABLO""","COLEGIO PREUNIVERSITARIO ""SAN PABLO""",VESPERTINA,VESPERTINA,MONOLINGUE,MONOLINGUE,DIARIO(REGULAR),DIARIO(REGULAR),YANDRI YAJAIRA RAMÍREZ ORTÍZ,YANDRI YAJAIRA RAMÍREZ ORTÍZ,ABIERTA,ABIERTA
100.0,05-06-0034-46,05-06-0083-46,"COLEGIO PRIVADO MIXTO ""BENDICIÓN DEL SABER""","COLEGIO PRIVADO MIXTO ""BENDICIÓN DEL SABER""",VESPERTINA,VESPERTINA,MONOLINGUE,MONOLINGUE,DIARIO(REGULAR),DIARIO(REGULAR),ZOILA ERNESTINA MORALES GODOY,ZOILA ERNESTINA MORALES GODOY,ABIERTA,ABIERTA
100.0,05-09-0081-46,05-09-0087-46,"COLEGIO PREUNIVERSITARIO ""SAN PABLO""","COLEGIO PREUNIVERSITARIO ""SAN PABLO""",VESPERTINA,VESPERTINA,MONOLINGUE,MONOLINGUE,DIARIO(REGULAR),DIARIO(REGULAR),YANDRI YAJAIRA RAMÍREZ ORTÍZ,YANDRI YAJAIRA RAMÍREZ ORTÍZ,ABIERTA,ABIERTA
100.0,05-09-0081-46,05-09-0083-46,"COLEGIO PREUNIVERSITARIO ""SAN PABLO""","COLEGIO PREUNIVERSITARIO ""SAN PABLO""",VESPERTINA,VESPERTINA,MONOLINGUE,MONOLINGUE,DIARIO(REGULAR),DIARIO(REGULAR),YANDRI YAJAIRA RAMÍREZ ORTÍZ,YANDRI YAJAIRA RAMÍREZ ORTÍZ,ABIERTA,ABIERTA
100.0,05-09-0066-46,05-09-0067-46,COLEGIO MIXTO PARTICULAR LICEO GUATEMALA DEL SUR,COLEGIO MIXTO PARTICULAR LICEO GUATEMALA DEL SUR,VESPERTINA,VESPERTINA,MONOLINGUE,MONOLINGUE,DIARIO(REGULAR),DIARIO(REGULAR),LUIS RODOLFO CARCAMO,LUIS RODOLFO CARCAMO,CERRADA TEMPORALMENTE,CERRADA TEMPORALMENTE
100.0,05-09-0059-46,05-09-0093-46,CENTRO EDUCATIVO GUATEMAYA,CENTRO EDUCATIVO GUATEMAYA,VESPERTINA,VESPERTINA,MONOLINGUE,MONOLINGUE,DIARIO(REGULAR),DIARIO(REGULAR),SERGIO ARDANY ALVARADO LÓPEZ,SERGIO ARDANY ALVARADO LÓPEZ,ABIERTA,ABIERTA
100.0,05-09-0058-46,05-09-0093-46,CENTRO EDUCATIVO GUATEMAYA,CENTRO EDUCATIVO GUATEMAYA,VESPERTINA,VESPERTINA,MONOLINGUE,MONOLINGUE,DIARIO(REGULAR),DIARIO(REGULAR),SERGIO ARDANY ALVARADO LÓPEZ,SERGIO ARDANY ALVARADO LÓPEZ,ABIERTA,ABIERTA
100.0,05-09-0058-46,05-09-0059-46,CENTRO EDUCATIVO GUATEMAYA,CENTRO EDUCATIVO GUATEMAYA,VESPERTINA,VESPERTINA,MONOLINGUE,MONOLINGUE,DIARIO(REGULAR),DIARIO(REGULAR),SERGIO ARDANY ALVARADO LÓPEZ,SERGIO ARDANY ALVARADO LÓPEZ,ABIERTA,ABIERTA
100.0,05-07-0063-46,05-07-0066-46,"COLEGIO MIXTO ""LUIS CARDOZA Y ARAGÓN""","COLEGIO MIXTO ""LUIS CARDOZA Y ARAGÓN""",VESPERTINA,VESPERTINA,MONOLINGUE,MONOLINGUE,DIARIO(REGULAR),DIARIO(REGULAR),KIMBERLY YAMILETH ESPINOZA ESCOBAR,KIMBERLY YAMILETH ESPINOZA ESCOBAR,ABIERTA,ABIERTA
100.0,05-06-0100-46,05-06-0103-46,INSTITUTO TECNOLOGÍA Y CIENCIA,INSTITUTO TECNOLOGÍA Y CIENCIA,VESPERTINA,VESPERTINA,MONOLINGUE,MONOLINGUE,DIARIO(REGULAR),DIARIO(REGULAR),WELLINGTÓN RONALDO LÚCAS ASPURÉZ,WELLINGTÓN RONALDO LÚCAS ASPURÉZ,ABIERTA,ABIERTA
100.0,05-06-0082-46,05-06-0103-46,INSTITUTO TECNOLOGÍA Y CIENCIA,INSTITUTO TECNOLOGÍA Y CIENCIA,VESPERTINA,VESPERTINA,MONOLINGUE,MONOLINGUE,DIARIO(REGULAR),DIARIO(REGULAR),WELLINGTÓN RONALDO LÚCAS ASPURÉZ,WELLINGTÓN RONALDO LÚCAS ASPURÉZ,ABIERTA,ABIERTA
100.0,05-06-0082-46,05-06-0100-46,INSTITUTO TECNOLOGÍA Y CIENCIA,INSTITUTO TECNOLOGÍA Y CIENCIA,VESPERTINA,VESPERTINA,MONOLINGUE,MONOLINGUE,DIARIO(REGULAR),DIARIO(REGULAR),WELLINGTÓN RONALDO LÚCAS ASPURÉZ,WELLINGTÓN RONALDO LÚCAS ASPURÉZ,ABIERTA,ABIERTA
100.0,05-06-0066-46,05-06-0083-46,"COLEGIO PRIVADO MIXTO ""BENDICIÓN DEL SABER""","COLEGIO PRIVADO MIXTO ""BENDICIÓN DEL SABER""",VESPERTINA,VESPERTINA,MONOLINGUE,MONOLINGUE,DIARIO(REGULAR),DIARIO(REGULAR),ZOILA ERNESTINA MORALES GODOY,ZOILA ERNESTINA MORALES GODOY,ABIERTA,ABIERTA
100.0,05-06-0057-46,05-06-0108-46,COLEGIO TECNOLÓGICO EN INFORMÁTICA MILJU-NET,COLEGIO TECNOLÓGICO EN INFORMÁTICA MILJU-NET,VESPERTINA,VESPERTINA,MONOLINGUE,MONOLINGUE,DIARIO(REGULAR),DIARIO(REGULAR),MILVIA EMPERATRIZ AGUILAR PAPPA,MILVIA EMPERATRIZ AGUILAR PAPPA,ABIERTA,ABIERTA
100.0,01-15-0813-46,01-15-0815-46,INED INSTITUTO NACIONAL DE EDUCACIÓN DIVERSIFICADA DE BÁRCENA,INED INSTITUTO NACIONAL DE EDUCACIÓN DIVERSIFICADA DE BÁRCENA,NOCTURNA,NOCTURNA,MONOLINGUE,MONOLINGUE,DIARIO(REGULAR),DIARIO(REGULAR),DESCONOCIDO,DESCONOCIDO,TEMPORAL NOMBRAMIENTO,TEMPORAL NOMBRAMIENTO
100.0,05-06-0051-46,05-06-0083-46,"COLEGIO PRIVADO MIXTO ""BENDICIÓN DEL SABER""","COLEGIO PRIVADO MIXTO ""BENDICIÓN DEL SABER""",VESPERTINA,VESPERTINA,MONOLINGUE,MONOLINGUE,DIARIO(REGULAR),DIARIO(REGULAR),ZOILA ERNESTINA MORALES GODOY,ZOILA ERNESTINA MORALES GODOY,ABIERTA,ABIERTA
100.0,05-06-0051-46,05-06-0066-46,"COLEGIO PRIVADO MIXTO ""BENDICIÓN DEL SABER""","COLEGIO PRIVADO MIXTO ""BENDICIÓN DEL SABER""",VESPERTINA,VESPERTINA,MONOLINGUE,MONOLINGUE,DIARIO(REGULAR),DIARIO(REGULAR),ZOILA ERNESTINA MORALES GODOY,ZOILA ERNESTINA MORALES GODOY,ABIERTA,ABIERTA
100.0,05-06-0039-46,05-06-0108-46,COLEGIO TECNOLÓGICO EN INFORMÁTICA MILJU-NET,COLEGIO TECNOLÓGICO EN INFORMÁTICA MILJU-NET,VESPERTINA,VESPERTINA,MONOLINGUE,MONOLINGUE,DIARIO(REGULAR),DIARIO(REGULAR),MILVIA EMPERATRIZ AGUILAR PAPPA,MILVIA EMPERATRIZ AGUILAR PAPPA,ABIERTA,ABIERTA
100.0,05-06-0039-46,05-06-0057-46,COLEGIO TECNOLÓGICO EN INFORMÁTICA MILJU-NET,COLEGIO TECNOLÓGICO EN INFORMÁTICA MILJU-NET,VESPERTINA,VESPERTINA,MONOLINGUE,MONOLINGUE,DIARIO(REGULAR),DIARIO(REGULAR),MILVIA EMPERATRIZ AGUILAR PAPPA,MILVIA EMPERATRIZ AGUILAR PAPPA,ABIERTA,ABIERTA
100.0,00-01-0683-46,00-01-9825-46,LICEO VICTORIA Y LIBERTAD,LICEO VICTORIA Y LIBERTAD,MATUTINA,MATUTINA,MONOLINGUE,MONOLINGUE,DIARIO(REGULAR),DIARIO(REGULAR),ERIKA ANABELLA MANSILLA MEJÍA,ERIKA ANABELLA MANSILLA MEJÍA,ABIERTA,ABIERTA
100.0,01-13-0041-46,01-13-0042-46,COLEGIO CLUB SOCIAL Y DEPORTIVO MUNICIPAL,COLEGIO CLUB SOCIAL Y DEPORTIVO MUNICIPAL,DOBLE,DOBLE,MONOLINGUE,MONOLINGUE,FIN DE SEMANA,FIN DE SEMANA,HAROLDO ANTONIO FIGUEROA LOPEZ,HAROLDO ANTONIO FIGUEROA LOPEZ,CERRADA TEMPORALMENTE,CERRADA TEMPORALMENTE
100.0,00-01-0666-46,00-01-0667-46,LICEO HISPANOAMERICANO NO. 4,LICEO HISPANOAMERICANO NO. 4,DOBLE,DOBLE,MONOLINGUE,MONOLINGUE,FIN DE SEMANA,FIN DE SEMANA,LESLY LORENA SOLARES ANZUETO,LESLY LORENA SOLARES ANZUETO,CERRADA TEMPORALMENTE,CERRADA TEMPORALMENTE
100.0,15-01-0157-46,15-01-0160-46,LICEO SAN RAFAEL,LICEO SAN RAFAEL,DOBLE,DOBLE,MONOLINGUE,MONOLINGUE,FIN DE SEMANA,FIN DE SEMANA,LUIS ALBERTO GARCÍA QUEJ,LUIS ALBERTO GARCÍA QUEJ,CERRADA TEMPORALMENTE,CERRADA TEMPORALMENTE
100.0,07-03-0006-46,07-03-0010-46,INSTITUTO PRIVADO LA SALLE,INSTITUTO PRIVADO LA SALLE,MATUTINA,MATUTINA,MONOLINGUE,MONOLINGUE,DIARIO(REGULAR),DIARIO(REGULAR),JEREMÍAS NICOLÁS UJPÁN MENDOZA,JEREMÍAS NICOLÁS UJPÁN MENDOZA,CERRADA DEFINITIVAMENTE,CERRADA DEFINITIVAMENTE
100.0,00-01-0605-46,00-01-7321-46,LICEO TÉCNICO CIENCIA Y DESARROLLO,LICEO TÉCNICO CIENCIA Y DESARROLLO,MATUTINA,MATUTINA,MONOLINGUE,MONOLINGUE,DIARIO(REGULAR),DIARIO(REGULAR),MYRIAM JEANNETTE CIFUENTES ORTIZ,MYRIAM JEANNETTE CIFUENTES ORTIZ,CERRADA TEMPORALMENTE,CERRADA TEMPORALMENTE
100.0,06-01-0108-46,06-01-0109-46,COLEGIO PARTICULAR MIXTO BILINGÜE SANTA FAMILIA,COLEGIO PARTICULAR MIXTO BILINGÜE SANTA FAMILIA,VESPERTINA,VESPERTINA,MONOLINGUE,MONOLINGUE,DIARIO(REGULAR),DIARIO(REGULAR),DAVID GUILLERMO BARRIENTOS VALDEZ,DAVID GUILLERMO BARRIENTOS VALDEZ,CERRADA DEFINITIVAMENTE,CERRADA DEFINITIVAMENTE
100.0,06-01-0103-46,06-01-1761-46,COLEGIO TECNOLOGICO BILINGUE EL HERMANO PEDRO,COLEGIO TECNOLOGICO BILINGUE EL HERMANO PEDRO,DOBLE,DOBLE,MONOLINGUE,MONOLINGUE,FIN DE SEMANA,FIN DE SEMANA,CÉSAR AUGUSTO MIRANDA QUINTANILLA,CÉSAR AUGUSTO MIRANDA QUINTANILLA,CERRADA DEFINITIVAMENTE,CERRADA DEFINITIVAMENTE
100.0,12-30-0069-46,12-30-0080-46,"""COLEGIO EDUCATIVO MIXTO LUNA AZUL -CEMLA-""","""COLEGIO EDUCATIVO MIXTO LUNA AZUL -CEMLA-""",VESPERTINA,VESPERTINA,MONOLINGUE,MONOLINGUE,DIARIO(REGULAR),DIARIO(REGULAR),BETY PATRICIA OXLAJ PÉREZ,BETY PATRICIA OXLAJ PÉREZ,ABIERTA,ABIERTA
100.0,18-04-0411-46,18-04-0412-46,"INSTITUTO PRIVADO MIXTO ""FUENTE DE VIDA""","INSTITUTO PRIVADO MIXTO ""FUENTE DE VIDA""",DOBLE,DOBLE,MONOLINGUE,MONOLINGUE,FIN DE SEMANA,FIN DE SEMANA,KARLA MARISOL PIVARAL PÉREZ,KARLA MARISOL PIVARAL PÉREZ,ABIERTA,ABIERTA
100.0,18-04-0422-46,18-04-0423-46,"INSTITUTO PRIVADO MIXTO ""CRISTO REY""","INSTITUTO PRIVADO MIXTO ""CRISTO REY""",DOBLE,DOBLE,MONOLINGUE,MONOLINGUE,FIN DE SEMANA,FIN DE SEMANA,NANCY CAROLA GÁMEZ ORTÍZ,NANCY CAROLA GÁMEZ ORTÍZ,ABIERTA,ABIERTA
100.0,09-01-0476-46,09-01-0540-46,"CENTRO EDUCATIVO ""ISEA QUETZALTENANGO""","CENTRO EDUCATIVO ""ISEA QUETZALTENANGO""",SIN JORNADA,SIN JORNADA,MONOLINGUE,MONOLINGUE,A DISTANCIA,A DISTANCIA,MICHAEL ALEXANDER ALVARADO ESCOBAR,MICHAEL ALEXANDER ALVARADO ESCOBAR,ABIERTA,ABIERTA
100.0,12-19-0101-46,12-19-0125-46,COLEGIO MIXTO LICEO ORIZABA,COLEGIO MIXTO LICEO ORIZABA,SIN JORNADA,SIN JORNADA,MONOLINGUE,MONOLINGUE,SEMIPRESENCIAL (UN DÍA A LA SEMANA),SEMIPRESENCIAL (UN DÍA A LA SEMANA),CINDY NOHEMÍ LÓPEZ CHILEL,CINDY NOHEMÍ LÓPEZ CHILEL,ABIERTA,ABIERTA
100.0,12-15-0163-46,12-15-0164-46,INSTITUTO TECNOLÓGICO EMPRESARIAL,INSTITUTO TECNOLÓGICO EMPRESARIAL,DOBLE,DOBLE,MONOLINGUE,MONOLINGUE,FIN DE SEMANA,FIN DE SEMANA,LISSAN IVETH OROZCO TRINIDAD,LISSAN IVETH OROZCO TRINIDAD,CERRADA TEMPORALMENTE,CERRADA TEMPORALMENTE
100.0,12-15-0155-46,12-15-0156-46,"COLEGIO SUPERIOR ""HARVARD""","COLEGIO SUPERIOR ""HARVARD""",DOBLE,DOBLE,MONOLINGUE,MONOLINGUE,FIN DE SEMANA,FIN DE SEMANA,JUAN HUMBERTO PAZ DOMINGUEZ,JUAN HUMBERTO PAZ DOMINGUEZ,CERRADA TEMPORALMENTE,CERRADA TEMPORALMENTE
100.0,12-15-0142-46,12-15-0143-46,COLEGIO AMISADAI,COLEGIO AMISADAI,DOBLE,DOBLE,MONOLINGUE,MONOLINGUE,FIN DE SEMANA,FIN DE SEMANA,JOSÉ MOISÉS CALDERÓN OCHOA,JOSÉ MOISÉS CALDERÓN OCHOA,CERRADA TEMPORALMENTE,CERRADA TEMPORALMENTE
100.0,12-15-0134-46,12-15-0135-46,"INSTITUTO PARTICULAR TECNICO VOCACIONAL ""PRACTICO MODERNO""","INSTITUTO PARTICULAR TECNICO VOCACIONAL ""PRACTICO MODERNO""",DOBLE,DOBLE,MONOLINGUE,MONOLINGUE,FIN DE SEMANA,FIN DE SEMANA,HÉCTOR AUGUSTO OCHOA GONZÁLEZ,HÉCTOR AUGUSTO OCHOA GONZÁLEZ,CERRADA TEMPORALMENTE,CERRADA TEMPORALMENTE
100.0,12-15-0114-46,12-15-0115-46,COLEGIO EVANGÉLICO MIXTO CENTROAMERICANO,COLEGIO EVANGÉLICO MIXTO CENTROAMERICANO,DOBLE,DOBLE,MONOLINGUE,MONOLINGUE,FIN DE SEMANA,FIN DE SEMANA,SARA ELIZABETH DARDON DE OROZCO,SARA ELIZABETH DARDON DE OROZCO,CERRADA TEMPORALMENTE,CERRADA TEMPORALMENTE
100.0,12-15-0097-46,12-15-0144-46,"LICEO PRE-UNIVERSITARIO ""LA FE""","LICEO PRE-UNIVERSITARIO ""LA FE""",DOBLE,DOBLE,MONOLINGUE,MONOLINGUE,FIN DE SEMANA,FIN DE SEMANA,MARIA CONCEPCION TEO SOLIS,MARIA CONCEPCION TEO SOLIS,ABIERTA,ABIERTA
100.0,07-13-0047-46,07-13-0048-46,"CENTRO EDUCATIVO PRIVADO ""SABIDURÍA"" CEPSA","CENTRO EDUCATIVO PRIVADO ""SABIDURÍA"" CEPSA",DOBLE,DOBLE,MONOLINGUE,MONOLINGUE,FIN DE SEMANA,FIN DE SEMANA,ABEL COROXÓN XALIX,ABEL COROXÓN XALIX,CERRADA DEFINITIVAMENTE,CERRADA DEFINITIVAMENTE
100.0,15-03-0088-46,15-03-2053-46,COLEGIO PARTICULAR MIXTO VIDA NUEVA,COLEGIO PARTICULAR MIXTO VIDA NUEVA,DOBLE,DOBLE,MONOLINGUE,MONOLINGUE,FIN DE SEMANA,FIN DE SEMANA,IRRAEL GONZALEZ GONZALEZ,IRRAEL GONZALEZ GONZALEZ,CERRADA DEFINITIVAMENTE,CERRADA DEFINITIVAMENTE
100.0,12-13-0071-46,12-13-0090-46,COLEGIO PARTICULAR MIXTO LA FAMILIA,COLEGIO PARTICULAR MIXTO LA FAMILIA,VESPERTINA,VESPERTINA,MONOLINGUE,MONOLINGUE,DIARIO(REGULAR),DIARIO(REGULAR),OMAR ENRIQUE BARRIOS LONGO,OMAR ENRIQUE BARRIOS LONGO,ABIERTA,ABIERTA
100.0,15-03-0778-46,15-03-1888-46,CENTRO CULTURAL DE AMERICA,CENTRO CULTURAL DE AMERICA,VESPERTINA,VESPERTINA,MONOLINGUE,MONOLINGUE,DIARIO(REGULAR),DIARIO(REGULAR),FABIO RAXCACO ISMALEJ,FABIO RAXCACO ISMALEJ,ABIERTA,ABIERTA
100.0,10-04-0018-46,10-04-0019-46,"COLEGIO PRIVADO MIXTO ""CIENCIA Y TECNOLOGIA""","COLEGIO PRIVADO MIXTO ""CIENCIA Y TECNOLOGIA""",DOBLE,DOBLE,MONOLINGUE,MONOLINGUE,FIN DE SEMANA,FIN DE SEMANA,GILDA MARIELA FLORES MAZARIEGOS,GILDA MARIELA FLORES MAZARIEGOS,ABIERTA,ABIERTA
100.0,10-02-0056-46,10-02-0057-46,INSTITUTO TECNOLOGICO CIENTIFICO INDUSTRIAL DE SUCHITEPEQUEZ,INSTITUTO TECNOLOGICO CIENTIFICO INDUSTRIAL DE SUCHITEPEQUEZ,DOBLE,DOBLE,MONOLINGUE,MONOLINGUE,FIN DE SEMANA,FIN DE SEMANA,JOSE LINO MALTEZ CASTILLO,JOSE LINO MALTEZ CASTILLO,ABIERTA,ABIERTA
100.0,10-01-2604-46,10-01-2605-46,COLEGIO TECNICO SUCHITEPEQUEZ,COLEGIO TECNICO SUCHITEPEQUEZ,DOBLE,DOBLE,MONOLINGUE,MONOLINGUE,FIN DE SEMANA,FIN DE SEMANA,BRENDA LORENY PEREZ MAYORGA,BRENDA LORENY PEREZ MAYORGA,CERRADA TEMPORALMENTE,CERRADA TEMPORALMENTE
100.0,10-01-2500-46,10-01-2501-46,COLEGIO PRIVADO MIXTO 'SAN FRANCISCO DE ASIS',COLEGIO PRIVADO MIXTO 'SAN FRANCISCO DE ASIS',DOBLE,DOBLE,MONOLINGUE,MONOLINGUE,FIN DE SEMANA,FIN DE SEMANA,DESCONOCIDO,DESCONOCIDO,CERRADA TEMPORALMENTE,CERRADA TEMPORALMENTE
100.0,10-01-0391-46,10-01-0417-46,"COLEGIO PRIVADO MIXTO ""GALILEO GALILEI""","COLEGIO PRIVADO MIXTO ""GALILEO GALILEI""",SIN JORNADA,SIN JORNADA,MONOLINGUE,MONOLINGUE,SEMIPRESENCIAL (UN DÍA A LA SEMANA),SEMIPRESENCIAL (UN DÍA A LA SEMANA),BRYAN JOÉ CALDERÓN ALBERTO,BRYAN JOÉ CALDERÓN ALBERTO,ABIERTA,ABIERTA
